{
  "$schema": "https://cryptojym.github.io/ofone-skillchain/schemas/ofone.deep-research-launch.schema.json",
  "protocol_version": "ofone-deep-research-launch-0.1",
  "queue_id": "2026-05-21-formal-frontier-r1-chrome-extension",
  "generated_at": "2026-05-21T09:34:52-06:00",
  "source_of_truth": {
    "tracker": "research/TRACKER.md",
    "status_ledger": "research/status/2026-05-17-07-ofone-post-run06-hardening-review.md",
    "loop": "research/recursive-improvement-loop.md"
  },
  "launch_surface_policy": {
    "primary_surface": "chrome_extension_plugin",
    "requires_isolated_tab": true,
    "supports_parallel_tabs": true,
    "desktop_automation_fallback_allowed": false,
    "unavailable_diagnostic_required": true,
    "blocked_status": "prepared_blocked_chrome_extension_unavailable"
  },
  "items": [
    {
      "item_id": "2026-05-17-batch-01__case-formal-proof-search-001__direct_answer__frontier_reasoning__r1",
      "batch_id": "2026-05-17-batch-01",
      "case_id": "case-formal-proof-search-001",
      "arm": "direct_answer",
      "model_family": "frontier_reasoning",
      "repeat": 1,
      "packet_path": "benchmarks/runs/2026-05-17-batch-01/frontier-run-packets/2026-05-21-formal-proof-search-frontier-r1.md",
      "prompt_anchor": "## Prompt 1: Direct Answer",
      "status": "reviewed",
      "blocked_reason": "Resolved: Chrome extension plugin control is available; direct-answer formal proof-search frontier run was harvested from completed ChatGPT Deep Research output and locally reviewed.",
      "required_launch_proof": [
        "callable Chrome extension/plugin control",
        "clean isolated ChatGPT tab or conversation",
        "visible current Pro/frontier-capable model label",
        "highest available visible reasoning mode",
        "Deep Research enabled when available",
        "generated plan or equivalent run-start proof",
        "Start or countdown action",
        "visible active research state",
        "stop-control evidence"
      ],
      "disallowed_surfaces": [
        "Browser",
        "Computer Use",
        "coordinate clicking",
        "AppleScript/JXA",
        "generic desktop automation"
      ],
      "expected_output_path": "benchmarks/runs/2026-05-17-batch-01/outputs/2026-05-17-batch-01__case-formal-proof-search-001__direct_answer__frontier_reasoning__r1.md",
      "expected_review_path": "benchmarks/reviews/2026-05-17-batch-01/2026-05-17-batch-01__case-formal-proof-search-001__direct_answer__frontier_reasoning__r1.md",
      "aggregate_policy": "aggregate_eligible_after_review",
      "conversation_url": "https://chatgpt.com/c/6a0f0a85-c75c-83e8-b0d0-4c15a041cb7b",
      "launch_proof_path": "research/deep-research-extension-report.json"
    },
    {
      "item_id": "2026-05-17-batch-01__case-formal-proof-search-001__light_structured__frontier_reasoning__r1",
      "batch_id": "2026-05-17-batch-01",
      "case_id": "case-formal-proof-search-001",
      "arm": "light_structured",
      "model_family": "frontier_reasoning",
      "repeat": 1,
      "packet_path": "benchmarks/runs/2026-05-17-batch-01/frontier-run-packets/2026-05-21-formal-proof-search-frontier-r1.md",
      "prompt_anchor": "## Prompt 2: Light Structured",
      "status": "completed_report_visible",
      "blocked_reason": "Completed report visible through Chrome extension control; raw Markdown harvest is blocked pending an extension-safe export path because the Deep Research report body and download control are inside a cross-origin sandbox iframe. Browser, Computer Use, coordinate clicking, AppleScript/JXA, and generic desktop automation remain disallowed.",
      "required_launch_proof": [
        "callable Chrome extension/plugin control",
        "clean isolated ChatGPT tab or conversation",
        "visible current Pro/frontier-capable model label",
        "highest available visible reasoning mode",
        "Deep Research enabled when available",
        "generated plan or equivalent run-start proof",
        "Start or countdown action",
        "visible active research state",
        "stop-control evidence"
      ],
      "disallowed_surfaces": [
        "Browser",
        "Computer Use",
        "coordinate clicking",
        "AppleScript/JXA",
        "generic desktop automation"
      ],
      "expected_output_path": "benchmarks/runs/2026-05-17-batch-01/outputs/2026-05-17-batch-01__case-formal-proof-search-001__light_structured__frontier_reasoning__r1.md",
      "expected_review_path": "benchmarks/reviews/2026-05-17-batch-01/2026-05-17-batch-01__case-formal-proof-search-001__light_structured__frontier_reasoning__r1.md",
      "aggregate_policy": "not_eligible_until_harvest_review_publication",
      "conversation_url": "https://chatgpt.com/c/6a0f1fe5-3494-83e8-9f92-1a2b732c4958",
      "launch_proof_path": "research/deep-research-extension-report.json"
    },
    {
      "item_id": "2026-05-17-batch-01__case-formal-proof-search-001__full_ofone__frontier_reasoning__r1",
      "batch_id": "2026-05-17-batch-01",
      "case_id": "case-formal-proof-search-001",
      "arm": "full_ofone",
      "model_family": "frontier_reasoning",
      "repeat": 1,
      "packet_path": "benchmarks/runs/2026-05-17-batch-01/frontier-run-packets/2026-05-21-formal-proof-search-frontier-r1.md",
      "prompt_anchor": "## Prompt 3: Full OfOne",
      "status": "prepared_not_launched",
      "blocked_reason": "Prepared for the next Chrome-extension-managed isolated Deep Research launch. Launch proof must be captured before this item can leave prepared_not_launched; the existing light-structured completed-visible blocker remains unharvested and not aggregate-eligible.",
      "required_launch_proof": [
        "callable Chrome extension/plugin control",
        "clean isolated ChatGPT tab or conversation",
        "visible current Pro/frontier-capable model label",
        "highest available visible reasoning mode",
        "Deep Research enabled when available",
        "generated plan or equivalent run-start proof",
        "Start or countdown action",
        "visible active research state",
        "stop-control evidence"
      ],
      "disallowed_surfaces": [
        "Browser",
        "Computer Use",
        "coordinate clicking",
        "AppleScript/JXA",
        "generic desktop automation"
      ],
      "expected_output_path": "benchmarks/runs/2026-05-17-batch-01/outputs/2026-05-17-batch-01__case-formal-proof-search-001__full_ofone__frontier_reasoning__r1.md",
      "expected_review_path": "benchmarks/reviews/2026-05-17-batch-01/2026-05-17-batch-01__case-formal-proof-search-001__full_ofone__frontier_reasoning__r1.md",
      "aggregate_policy": "not_eligible_until_harvest_review_publication"
    }
  ]
}
